wiki_path,idx,column,source,old_cell,new_cell,status,hops,terminal_object,exhausted_reason
knowledge/synapse/Wiki/BI_DB_dbo/Functions/Function_MIMO_First_Deposit_All_Platforms.md,24,RiskClassificationID,Fact_SnapshotCustomer.RiskClassificationID,Direct,Risk classification tier for compliance. DEFAULT 0. Source: Ext_FSC_BackOffice_Customer.RiskClassificationID (BO). FK to Dim_RiskClassification. (Tier 2 - SP_Fact_SnapshotCustomer) (via Fact_SnapshotCustomer),FOUND,2,Fact_SnapshotCustomer,
knowledge/synapse/Wiki/BI_DB_dbo/Functions/Function_MIMO_First_Deposit_All_Platforms.md,25,CommunicationLanguageID,Fact_SnapshotCustomer.CommunicationLanguageID,Direct,Preferred communication language (may differ from interface language). DEFAULT 0. Source: Ext_FSC_Real_Customer_Customer.CommunicationLanguageID (CC). FK to Dim_Language. (Tier 2 - SP_Fact_SnapshotCustomer) (via Fact_SnapshotCustomer),FOUND,2,Fact_SnapshotCustomer,
knowledge/synapse/Wiki/BI_DB_dbo/Functions/Function_MIMO_First_Deposit_All_Platforms.md,26,PremiumAccount,Fact_SnapshotCustomer.PremiumAccount,Direct,[UNVERIFIED] Legacy: premium account flag. NOT populated by current SP. DEFAULT 0. (Tier 4 - inferred from DDL) (via Fact_SnapshotCustomer),FOUND,2,Fact_SnapshotCustomer,
knowledge/synapse/Wiki/BI_DB_dbo/Functions/Function_MIMO_First_Deposit_All_Platforms.md,27,Evangelist,Fact_SnapshotCustomer.Evangelist,Direct,[UNVERIFIED] Legacy: evangelist/ambassador status flag. NOT populated by current SP. DEFAULT 0. (Tier 4 - inferred from DDL) (via Fact_SnapshotCustomer),FOUND,2,Fact_SnapshotCustomer,
knowledge/synapse/Wiki/BI_DB_dbo/Functions/Function_MIMO_First_Deposit_All_Platforms.md,28,GuruStatusID,Fact_SnapshotCustomer.GuruStatusID,Direct,Popular Investor (Guru) program status. DEFAULT 0. Source: Ext_FSC_BackOffice_Customer.GuruStatusID (BO). FK to Dim_GuruStatus. (Tier 2 - SP_Fact_SnapshotCustomer) (via Fact_SnapshotCustomer),FOUND,2,Fact_SnapshotCustomer,
knowledge/synapse/Wiki/BI_DB_dbo/Functions/Function_MIMO_First_Deposit_All_Platforms.md,29,UpdateDate,Fact_SnapshotCustomer.UpdateDate,Direct,DWH load timestamp. Set to GETDATE() at ETL execution. Not the customer event date. DEFAULT 0 (DDL default is 0 but SP sets GETDATE()). (Tier 2 - SP_Fact_SnapshotCustomer) (via Fact_SnapshotCustomer),FOUND,2,Fact_SnapshotCustomer,
knowledge/synapse/Wiki/BI_DB_dbo/Functions/Function_MIMO_First_Deposit_All_Platforms.md,30,RegulationID,Fact_SnapshotCustomer.RegulationID,Direct,Customer's assigned regulatory jurisdiction. DEFAULT 0. Sourced from Ext_FSC_BackOffice_RegulationChangeLog.ToRegulationID — end-of-day change. See §2.4. FK to Dim_Regulation. (Tier 2 - SP_Fact_SnapshotCustomer) (via Fact_SnapshotCustomer),FOUND,2,Fact_SnapshotCustomer,
knowledge/synapse/Wiki/BI_DB_dbo/Functions/Function_MIMO_First_Deposit_All_Platforms.md,31,AccountStatusID,Fact_SnapshotCustomer.AccountStatusID,Direct,"Account enabled/suspended status. DEFAULT 0. Distribution: 1=93.2% (Active), 0=6.1%, 2=0.9% (Inactive). Source: Ext_FSC_Real_Customer_Customer.AccountStatusID (CC). FK to Dim_AccountStatus. (Tier 2 - SP_Fact_SnapshotCustomer) (via Fact_SnapshotCustomer)",FOUND,2,Fact_SnapshotCustomer,
knowledge/synapse/Wiki/BI_DB_dbo/Functions/Function_MIMO_First_Deposit_All_Platforms.md,32,AccountManagerID,Fact_SnapshotCustomer.AccountManagerID,Direct,Assigned account manager (sales/retention). DEFAULT 0. Source: Ext_FSC_BackOffice_Customer.AccountManagerID (BO). FK to Dim_Manager. (Tier 2 - SP_Fact_SnapshotCustomer) (via Fact_SnapshotCustomer),FOUND,2,Fact_SnapshotCustomer,
knowledge/synapse/Wiki/BI_DB_dbo/Functions/Function_MIMO_First_Deposit_All_Platforms.md,33,PlayerLevelID,Fact_SnapshotCustomer.PlayerLevelID,Direct,"Account tier: 4=demo, other values=real tiers. DEFAULT 0. Source: Ext_FSC_Real_Customer_Customer.PlayerLevelID (CC). FK to Dim_PlayerLevel. Critical for IsValidCustomer (PlayerLevelID=4 excluded). (Tier 2 - SP_Fact_SnapshotCustomer) (via Fact_SnapshotCustomer)",FOUND,2,Fact_SnapshotCustomer,
knowledge/synapse/Wiki/BI_DB_dbo/Functions/Function_MIMO_First_Deposit_All_Platforms.md,34,AccountTypeID,Fact_SnapshotCustomer.AccountTypeID,Direct,"Account type (e.g., 7=Employee, 9=excluded type, 2=real account). DEFAULT 0. Source: Ext_FSC_BackOffice_Customer.AccountTypeID (BO). FK to Dim_AccountType. Used in IsCreditReportValidCB logic. (Tier 2 - SP_Fact_SnapshotCustomer) (via Fact_SnapshotCustomer)",FOUND,2,Fact_SnapshotCustomer,
knowledge/synapse/Wiki/BI_DB_dbo/Functions/Function_MIMO_First_Deposit_All_Platforms.md,35,DateRangeID,Fact_SnapshotCustomer.DateRangeID,Direct,"SCD2 range key: 12-digit bigint = YYYYMMDD (row open date) + MMDDD (year-end MMDD, typically 1231). E.g., 202603101231 = open 2026-03-10, closes 2026-12-31. Join to Dim_Range for FromDateID + ToDateID. See §2.1. (Tier 2 - SP_Fact_SnapshotCustomer) (via Fact_SnapshotCustomer)",FOUND,2,Fact_SnapshotCustomer,
knowledge/synapse/Wiki/BI_DB_dbo/Functions/Function_MIMO_First_Deposit_All_Platforms.md,36,IsDepositor,Fact_SnapshotCustomer.IsDepositor,Direct,1 if the customer has made at least one real-money deposit (FTD detected). Set when CID appears in Ext_FSC_Customer_FirstTimeDeposits. Never reverted to 0 once set. DEFAULT 0. (Tier 2 - SP_Fact_SnapshotCustomer) (via Fact_SnapshotCustomer),FOUND,2,Fact_SnapshotCustomer,
knowledge/synapse/Wiki/BI_DB_dbo/Functions/Function_MIMO_First_Deposit_All_Platforms.md,37,PendingClosureStatusID,Fact_SnapshotCustomer.PendingClosureStatusID,Direct,Status of a pending account closure request. DEFAULT 0. Source: Ext_FSC_Real_Customer_Customer.PendingClosureStatusID (CC). FK to Dim_PendingClosureStatus. (Tier 2 - SP_Fact_SnapshotCustomer) (via Fact_SnapshotCustomer),FOUND,2,Fact_SnapshotCustomer,
knowledge/synapse/Wiki/BI_DB_dbo/Functions/Function_MIMO_First_Deposit_All_Platforms.md,38,DocumentStatusID,Fact_SnapshotCustomer.DocumentStatusID,Direct,KYC document review status. DEFAULT 0. Source: Ext_FSC_BackOffice_Customer.DocumentStatusID (BO). FK to Dim_DocumentStatus. (Tier 2 - SP_Fact_SnapshotCustomer) (via Fact_SnapshotCustomer),FOUND,2,Fact_SnapshotCustomer,
knowledge/synapse/Wiki/BI_DB_dbo/Functions/Function_MIMO_First_Deposit_All_Platforms.md,39,SuitabilityTestStatusID,Fact_SnapshotCustomer.SuitabilityTestStatusID,Direct,MiFID suitability test completion status. DEFAULT 0. Source: Ext_FSC_BackOffice_Customer.SuitabilityTestStatusID (BO). (Tier 2 - SP_Fact_SnapshotCustomer) (via Fact_SnapshotCustomer),FOUND,2,Fact_SnapshotCustomer,
knowledge/synapse/Wiki/BI_DB_dbo/Functions/Function_MIMO_First_Deposit_All_Platforms.md,40,MifidCategorizationID,Fact_SnapshotCustomer.MifidCategorizationID,Direct,MiFID II client categorization (Retail/Professional/Eligible Counterparty). DEFAULT 0. Source: Ext_FSC_BackOffice_Customer.MifidCategorizationID (BO). FK to Dim_MifidCategorization. (Tier 2 - SP_Fact_SnapshotCustomer) (via Fact_SnapshotCustomer),FOUND,2,Fact_SnapshotCustomer,
knowledge/synapse/Wiki/BI_DB_dbo/Functions/Function_MIMO_First_Deposit_All_Platforms.md,41,IsEmailVerified,Fact_SnapshotCustomer.IsEmailVerified,Direct,1 if the customer has verified their email address. DEFAULT 0. Source: Ext_FSC_Real_Customer_Customer.IsEmailVerified (CC). (Tier 2 - SP_Fact_SnapshotCustomer) (via Fact_SnapshotCustomer),FOUND,2,Fact_SnapshotCustomer,
knowledge/synapse/Wiki/BI_DB_dbo/Functions/Function_MIMO_First_Deposit_All_Platforms.md,42,IsValidCustomer,Fact_SnapshotCustomer.IsValidCustomer,Direct,"1 if the customer is a valid retail customer for analytics purposes. ETL-computed from PlayerLevelID, LabelID, CountryID. See §2.2. Approx 98% of current rows = 1. (Tier 2 - SP_Fact_SnapshotCustomer) (via Fact_SnapshotCustomer)",FOUND,2,Fact_SnapshotCustomer,
knowledge/synapse/Wiki/BI_DB_dbo/Functions/Function_MIMO_First_Deposit_All_Platforms.md,43,DesignatedRegulationID,Fact_SnapshotCustomer.DesignatedRegulationID,Direct,Secondary/designated regulatory jurisdiction (separate from primary RegulationID). DEFAULT 0. Source: Ext_FSC_BackOffice_Customer.DesignatedRegulationID (BO). FK to Dim_Regulation. (Tier 2 - SP_Fact_SnapshotCustomer) (via Fact_SnapshotCustomer),FOUND,2,Fact_SnapshotCustomer,
knowledge/synapse/Wiki/BI_DB_dbo/Functions/Function_MIMO_First_Deposit_All_Platforms.md,44,EvMatchStatus,Fact_SnapshotCustomer.EvMatchStatus,Direct,eVerify (identity verification) match status. DEFAULT 0. Source: Ext_FSC_BackOffice_Customer.EvMatchStatus (BO). FK to Dim_EvMatchStatus. (Tier 2 - SP_Fact_SnapshotCustomer) (via Fact_SnapshotCustomer),FOUND,2,Fact_SnapshotCustomer,
knowledge/synapse/Wiki/BI_DB_dbo/Functions/Function_MIMO_First_Deposit_All_Platforms.md,45,RegionID,Fact_SnapshotCustomer.RegionID,Direct,Customer's geographic region (sub-country grouping). DEFAULT 0. Source: Ext_FSC_Real_Customer_Customer.RegionID (CC). (Tier 2 - SP_Fact_SnapshotCustomer) (via Fact_SnapshotCustomer),FOUND,2,Fact_SnapshotCustomer,
knowledge/synapse/Wiki/BI_DB_dbo/Functions/Function_MIMO_First_Deposit_All_Platforms.md,46,PlayerStatusReasonID,Fact_SnapshotCustomer.PlayerStatusReasonID,Direct,"Reason code for the current PlayerStatusID (e.g., why account was blocked). DEFAULT 0. Source: Ext_FSC_Real_Customer_Customer.PlayerStatusReasonID (CC). FK to Dim_PlayerStatusReasons. (Tier 2 - SP_Fact_SnapshotCustomer) (via Fact_SnapshotCustomer)",FOUND,2,Fact_SnapshotCustomer,
knowledge/synapse/Wiki/BI_DB_dbo/Functions/Function_MIMO_First_Deposit_All_Platforms.md,47,IsCreditReportValidCB,Fact_SnapshotCustomer.IsCreditReportValidCB,Direct,1 if customer is eligible for CreditBureau credit report validation. ETL-computed. See §2.3. (Tier 2 - SP_Fact_SnapshotCustomer) (via Fact_SnapshotCustomer),FOUND,2,Fact_SnapshotCustomer,
knowledge/synapse/Wiki/BI_DB_dbo/Functions/Function_MIMO_First_Deposit_All_Platforms.md,48,AffiliateID,Fact_SnapshotCustomer.AffiliateID,Direct,Affiliate/partner who referred this customer. DEFAULT 0. Source: Ext_FSC_Real_Customer_Customer.AffiliateID (CC). (Tier 2 - SP_Fact_SnapshotCustomer) (via Fact_SnapshotCustomer),FOUND,2,Fact_SnapshotCustomer,
knowledge/synapse/Wiki/BI_DB_dbo/Functions/Function_MIMO_First_Deposit_All_Platforms.md,49,Email,Fact_SnapshotCustomer.Email,Direct,"Customer email address (nvarchar(50), nullable). No DDL-level dynamic data masking is defined on this column. GDPR erasure handled in ETL. Source: Ext_FSC_Real_Customer_Customer.Email (CC). (via Fact_SnapshotCustomer)",FOUND,2,Fact_SnapshotCustomer,
knowledge/synapse/Wiki/BI_DB_dbo/Functions/Function_MIMO_First_Deposit_All_Platforms.md,50,City,Fact_SnapshotCustomer.City,Direct,"Customer city (nvarchar(50), nullable). No DDL-level dynamic data masking is defined on this column. GDPR erasure handled in ETL. Source: Ext_FSC_Real_Customer_Customer.City (CC). (via Fact_SnapshotCustomer)",FOUND,2,Fact_SnapshotCustomer,
knowledge/synapse/Wiki/BI_DB_dbo/Functions/Function_MIMO_First_Deposit_All_Platforms.md,51,Address,Fact_SnapshotCustomer.Address,Direct,Customer street address. PII: dynamically masked. GDPR erasure supported. Source: Ext_FSC_Real_Customer_Customer.Address (CC). (Tier 2 - SP_Fact_SnapshotCustomer) (via Fact_SnapshotCustomer),FOUND,2,Fact_SnapshotCustomer,
knowledge/synapse/Wiki/BI_DB_dbo/Functions/Function_MIMO_First_Deposit_All_Platforms.md,52,Zip,Fact_SnapshotCustomer.Zip,Direct,Customer postal code. PII: dynamically masked. GDPR erasure supported. Source: Ext_FSC_Real_Customer_Customer.Zip (CC). (Tier 2 - SP_Fact_SnapshotCustomer) (via Fact_SnapshotCustomer),FOUND,2,Fact_SnapshotCustomer,
knowledge/synapse/Wiki/BI_DB_dbo/Functions/Function_MIMO_First_Deposit_All_Platforms.md,53,PhoneNumber,Fact_SnapshotCustomer.PhoneNumber,Direct,Customer phone number. PII: not DDL-masked but GDPR-erased to 'DelPhoneNumber_XXXXXXX' for deleted users. Source: Ext_FSC_PhoneCustomer.PhoneNumber. (Tier 2 - SP_Fact_SnapshotCustomer) (via Fact_SnapshotCustomer),FOUND,2,Fact_SnapshotCustomer,
knowledge/synapse/Wiki/BI_DB_dbo/Functions/Function_MIMO_First_Deposit_All_Platforms.md,54,IsPhoneVerified,Fact_SnapshotCustomer.IsPhoneVerified,Direct,"1 if the customer's phone number has been verified (PhoneVerifiedID IN (1,2) in source). Source: Ext_FSC_PhoneCustomer. (Tier 2 - SP_Fact_SnapshotCustomer) (via Fact_SnapshotCustomer)",FOUND,2,Fact_SnapshotCustomer,
knowledge/synapse/Wiki/BI_DB_dbo/Functions/Function_MIMO_First_Deposit_All_Platforms.md,55,PhoneVerificationDateID,Fact_SnapshotCustomer.PhoneVerificationDateID,Direct,"Date the phone was verified, as YYYYMMDD string. Rows where PhoneVerificationDateID='19000101' are excluded from source. Source: Ext_FSC_PhoneCustomer. (Tier 2 - SP_Fact_SnapshotCustomer) (via Fact_SnapshotCustomer)",FOUND,2,Fact_SnapshotCustomer,
knowledge/synapse/Wiki/BI_DB_dbo/Functions/Function_MIMO_First_Deposit_All_Platforms.md,56,PlayerStatusSubReasonID,Fact_SnapshotCustomer.PlayerStatusSubReasonID,Direct,Sub-reason code for PlayerStatus (more granular than PlayerStatusReasonID). DEFAULT 0. Source: Ext_FSC_Real_Customer_Customer.PlayerStatusSubReasonID (CC). FK to Dim_PlayerStatusSubReasons. (Tier 2 - SP_Fact_SnapshotCustomer) (via Fact_SnapshotCustomer),FOUND,2,Fact_SnapshotCustomer,
knowledge/synapse/Wiki/BI_DB_dbo/Functions/Function_MIMO_Options_Platform.md,1,OfficeCode,External_Sodreconciliation_apex_EXT869_CashActivity.OfficeCode,Direct,Passthrough from BI_DB_dbo.External_Sodreconciliation_apex_EXT869_CashActivity.OfficeCode (no upstream wiki),FOUND,1,Function_MIMO_Options_Platform,
knowledge/synapse/Wiki/BI_DB_dbo/Functions/Function_MIMO_Options_Platform.md,2,RegisteredRepCode,External_Sodreconciliation_apex_EXT869_CashActivity.RegisteredRepCode,Direct,Passthrough from BI_DB_dbo.External_Sodreconciliation_apex_EXT869_CashActivity.RegisteredRepCode (no upstream wiki),FOUND,1,Function_MIMO_Options_Platform,
knowledge/synapse/Wiki/BI_DB_dbo/Functions/Function_MIMO_Options_Platform.md,3,AccountNumber,External_Sodreconciliation_apex_EXT869_CashActivity.AccountNumber,Direct,Passthrough from BI_DB_dbo.External_Sodreconciliation_apex_EXT869_CashActivity.AccountNumber (no upstream wiki),FOUND,1,Function_MIMO_Options_Platform,
knowledge/synapse/Wiki/BI_DB_dbo/Functions/Function_MIMO_Options_Platform.md,11,TransactionID,External_Sodreconciliation_apex_EXT869_CashActivity.ACATSControlNumber,Direct,Passthrough from BI_DB_dbo.External_Sodreconciliation_apex_EXT869_CashActivity.ACATSControlNumber (no upstream wiki),FOUND,1,Function_MIMO_Options_Platform,
knowledge/synapse/Wiki/BI_DB_dbo/Functions/Function_MIMO_Options_Platform.md,13,IsValidCustomer,Fact_SnapshotCustomer.IsValidCustomer,Direct,"1 if the customer is a valid retail customer for analytics purposes. ETL-computed from PlayerLevelID, LabelID, CountryID. See §2.2. Approx 98% of current rows = 1. (Tier 2 - SP_Fact_SnapshotCustomer) (via Fact_SnapshotCustomer)",FOUND,2,Fact_SnapshotCustomer,
knowledge/synapse/Wiki/BI_DB_dbo/Functions/Function_MIMO_Options_Platform.md,14,IsCreditReportValidCB,Fact_SnapshotCustomer.IsCreditReportValidCB,Direct,1 if customer is eligible for CreditBureau credit report validation. ETL-computed. See §2.3. (Tier 2 - SP_Fact_SnapshotCustomer) (via Fact_SnapshotCustomer),FOUND,2,Fact_SnapshotCustomer,
knowledge/synapse/Wiki/BI_DB_dbo/Functions/Function_PnL_Single_Day.md,2,CID,,Direct,Customer ID. References Customer.Customer. (Tier 1 — Trade.PositionTbl) (via Dim_Position),FOUND,2,Dim_Position,
knowledge/synapse/Wiki/BI_DB_dbo/Functions/Function_PnL_Single_Day.md,3,PositionID,,Direct,Primary key. Allocated by Internal.GetPositionID_Bigint. Unique per position. (Tier 1 — Trade.PositionTbl) (via Dim_Position),FOUND,2,Dim_Position,
knowledge/synapse/Wiki/BI_DB_dbo/Functions/Function_PnL_Single_Day.md,8,InstrumentID,,Direct,FK to Trade.Instrument. Financial instrument being traded. (Tier 1 — Trade.PositionTbl) (via Dim_Position),FOUND,2,Dim_Position,
knowledge/synapse/Wiki/BI_DB_dbo/Functions/Function_PnL_Single_Day.md,9,MirrorID,,Direct,FK to Trade.Mirror. 0/NULL = manual. Positive = copy-trade position. (Tier 1 — Trade.PositionTbl) (via Dim_Position),FOUND,2,Dim_Position,
knowledge/synapse/Wiki/BI_DB_dbo/Functions/Function_PnL_Single_Day.md,10,Leverage,,Direct,"Leverage multiplier (1, 5, 10, etc.). Determines margin and settlement type. (Tier 1 — Trade.PositionTbl) (via Dim_Position)",FOUND,2,Dim_Position,
knowledge/synapse/Wiki/BI_DB_dbo/Functions/Function_PnL_Single_Day.md,11,IsBuy,,Direct,"1 = Long/Buy (profit when price rises), 0 = Short/Sell. (Tier 1 — Trade.PositionTbl) (via Dim_Position)",FOUND,2,Dim_Position,
knowledge/synapse/Wiki/BI_DB_dbo/Functions/Function_PnL_Single_Day.md,12,IsSettled,,Direct,"1 = real asset, 0 = CFD asset. (Tier 5 — Expert Review) (via Dim_Position)",FOUND,2,Dim_Position,
knowledge/synapse/Wiki/BI_DB_dbo/Functions/Function_PnL_Single_Day.md,13,HedgeServerID,,Direct,FK to Trade.HedgeServer. Hedge server managing this position. (Tier 1 — Trade.PositionTbl) (via Dim_Position),FOUND,2,Dim_Position,
knowledge/synapse/Wiki/BI_DB_dbo/Functions/Function_PnL_Single_Day.md,14,SettlementTypeID,,Direct,"Modern settlement classification. Dictionary.SettlementTypes: 0=CFD, 1=REAL, 2=TRS, 3=CMT, 4=REAL_FUTURES, 5=MARGIN_TRADE. Replaces IsSettled. (Tier 1 — Trade.PositionTbl) (via Dim_Position)",FOUND,2,Dim_Position,
knowledge/synapse/Wiki/BI_DB_dbo/Functions/Function_PnL_Single_Day.md,15,ClosedOnDate,,Direct,"ISNULL(dp.ClosedOnDate, 0) (sql-derived [coalesce, DIVERGENT] from Function_PnL_Single_Day); branches: 1 when (dp.CloseDateID = @dateID) OR 0 (fallback); where dp = DWH_dbo.Dim_Position",FOUND,1,Function_PnL_Single_Day,
knowledge/synapse/Wiki/BI_DB_dbo/Functions/Function_PnL_Single_Day.md,16,IsFuture,,Direct,"1=futures contract (instrument in Trade.InstrumentGroups WHERE GroupID=25), 0=not futures. 243 flagged as futures. (Tier 2 — SP_Dim_Instrument) (via Dim_Instrument)",FOUND,2,Dim_Instrument,
knowledge/synapse/Wiki/BI_DB_dbo/Functions/Function_PnL_Single_Day.md,17,IsCopyFund,,Direct,CASE WHEN NOT cpt.PositionID IS NULL THEN 1 ELSE 0 END (sql-derived [case] from Function_PnL_Single_Day); where cpt = BI_DB_dbo.BI_DB_CopyFund_Positions,FOUND,1,Function_PnL_Single_Day,
knowledge/synapse/Wiki/BI_DB_dbo/Functions/Function_PnL_Single_Day.md,18,IsMarginTrade,,Direct,"COALESCE(dp.IsMarginTrade, upl.IsMarginTrade) (sql-derived [coalesce, DIVERGENT] from Function_PnL_Single_Day); branches: CASE WHEN dp.SettlementTypeID = 5 THEN 1 ELSE 0 END OR CASE WHEN bdppl.SettlementTypeID = 5 THEN 1 ELSE 0 END; where dp = DWH_dbo.Dim_Position, bdppl = BI_DB_dbo.BI_DB_PositionPnL",FOUND,1,Function_PnL_Single_Day,
knowledge/synapse/Wiki/BI_DB_dbo/Functions/Function_Population_Active_Traders.md,2,RealCID,"Fact_CustomerAction.RealCID, Function_Revenue_OptionsPlatform.RealCID",Direct,Real-account Customer ID. HASH distribution key. References `Dim_Customer.RealCID`. Each customer has one real CID. (Tier 1 — Customer.CustomerStatic) (via Fact_CustomerAction),FOUND,2,Fact_CustomerAction,
knowledge/synapse/Wiki/BI_DB_dbo/Functions/Function_Population_Active_Traders.md,3,DateID,"Fact_CustomerAction.DateID, Function_Revenue_OptionsPlatform.DateID",Direct,**`Occurred`** → `YYYYMMDD` int (nonclustered index driver). (Tier 2 — SP_Fact_CustomerAction) (via Fact_CustomerAction),FOUND,2,Fact_CustomerAction,
knowledge/synapse/Wiki/BI_DB_dbo/Functions/Function_Population_First_Time_Funded.md,2,FTDPlatformID,Dim_Customer.FTDPlatformID,Direct,Platform/account type of the first deposit (AccountTypeId from source). Added 2025-09-12. (Tier 2 — SP_Dim_Customer) (via Dim_Customer),FOUND,2,Dim_Customer,
knowledge/synapse/Wiki/BI_DB_dbo/Functions/Function_Population_First_Trading_Action.md,16,IsDepositor,Dim_Customer.IsDepositor,Direct from `Dim_Customer`,Whether the customer has ever deposited. DEFAULT=0. Updated post-load from FTD data. (Tier 2 — SP_Dim_Customer) (via Dim_Customer),FOUND,2,Dim_Customer,
knowledge/synapse/Wiki/BI_DB_dbo/Functions/Function_Population_First_Trading_Action.md,17,FirstDepositDate,Dim_Customer.FirstDepositDate,Direct from `Dim_Customer`,Date of first deposit. DEFAULT='19000101'. Updated from CustomerFinanceDB FTD data with FTDRecoveryDate logic. (Tier 2 — SP_Dim_Customer) (via Dim_Customer),FOUND,2,Dim_Customer,
knowledge/synapse/Wiki/BI_DB_dbo/Functions/Function_Search_Functions.md,2,function_name,sys.objects.name,Direct,Passthrough from sys.objects.name (no upstream wiki),FOUND,1,Function_Search_Functions,
knowledge/synapse/Wiki/BI_DB_dbo/Functions/Function_Search_Functions.md,3,function_type,sys.objects.type_desc,Direct,Passthrough from sys.objects.type_desc (no upstream wiki),FOUND,1,Function_Search_Functions,
knowledge/synapse/Wiki/BI_DB_dbo/Functions/Function_Trading_Volume_PositionLevel.md,2,PositionID,DWH_dbo.Dim_Position.PositionID,Direct,Primary key. Allocated by Internal.GetPositionID_Bigint. Unique per position. (Tier 1 — Trade.PositionTbl) (via Dim_Position),FOUND,2,Dim_Position,
knowledge/synapse/Wiki/BI_DB_dbo/Functions/Function_Trading_Volume_PositionLevel.md,3,InstrumentID,DWH_dbo.Dim_Position.InstrumentID,Direct,FK to Trade.Instrument. Financial instrument being traded. (Tier 1 — Trade.PositionTbl) (via Dim_Position),FOUND,2,Dim_Position,
knowledge/synapse/Wiki/BI_DB_dbo/Functions/Function_Trading_Volume_PositionLevel.md,4,Amount,DWH_dbo.Dim_Position.Amount,Direct,Position size in currency. Must be >= 0. Stored in dollars (PositionOpen divides by 100 from cents). (Tier 1 — Trade.PositionTbl) (via Dim_Position),FOUND,2,Dim_Position,
knowledge/synapse/Wiki/BI_DB_dbo/Functions/Function_Trading_Volume_PositionLevel.md,5,Leverage,DWH_dbo.Dim_Position.Leverage,Direct,"Leverage multiplier (1, 5, 10, etc.). Determines margin and settlement type. (Tier 1 — Trade.PositionTbl) (via Dim_Position)",FOUND,2,Dim_Position,
knowledge/synapse/Wiki/BI_DB_dbo/Functions/Function_Trading_Volume_PositionLevel.md,16,IsSettled,DWH_dbo.Dim_Position.IsSettled,Direct,"1 = real asset, 0 = CFD asset. (Tier 5 — Expert Review) (via Dim_Position)",FOUND,2,Dim_Position,
knowledge/synapse/Wiki/BI_DB_dbo/Functions/Function_Trading_Volume_PositionLevel.md,17,IsAirDrop,DWH_dbo.Dim_Position.IsAirDrop,Direct,1=position was created via an airdrop event (crypto). ETL-computed: JOIN to etoro_Trade_PositionAirdropLog. NULL=not an airdrop. (Tier 2 - SP_Dim_Position_DL_To_Synapse) (via Dim_Position),FOUND,2,Dim_Position,
knowledge/synapse/Wiki/BI_DB_dbo/Functions/Function_Trading_Volume_PositionLevel.md,18,IsBuy,DWH_dbo.Dim_Position.IsBuy,Direct,"1 = Long/Buy (profit when price rises), 0 = Short/Sell. (Tier 1 — Trade.PositionTbl) (via Dim_Position)",FOUND,2,Dim_Position,
knowledge/synapse/Wiki/BI_DB_dbo/Functions/Function_Trading_Volume_PositionLevel.md,19,SettlementTypeID,DWH_dbo.Dim_Position.SettlementTypeID,Direct,"Modern settlement classification. Dictionary.SettlementTypes: 0=CFD, 1=REAL, 2=TRS, 3=CMT, 4=REAL_FUTURES, 5=MARGIN_TRADE. Replaces IsSettled. (Tier 1 — Trade.PositionTbl) (via Dim_Position)",FOUND,2,Dim_Position,
knowledge/synapse/Wiki/DWH_dbo/Views/V_Liabilities.md,34,CopyFundAUM,Fact_SnapshotEquity.CopyFundAUM,Direct,"Passthrough — no upstream semantic (chain: V_Liabilities.CopyFundAUM -> Fact_SnapshotEquity.CopyFundAUM, column_not_found)",EXHAUSTED,2,,column_not_found
